,permit_ID,full_description
668,17014-20000-03730,"CONVERT LAUNDRY ROOM FOR KITCHEN EXPANSION AND BEDROOM TO DEN,  REMOVE ATTACHED ALUMINUM PATIO COVER AND ADD 24'11"" X 22'8"" FOR NEW BEDROOM/BATHROOM  PER ENGINEERING."
669,19016-20000-06047,INTERIOR REMODEL TO THE (E) SINGLE FAMILY DWELING. CONVERT KITCHEN INTO BEDROOM (SEE COMMENTS)
670,15010-20000-00464,"TRACT NEW 2-STORY SFD/ GAR. PLAN -2B."" plan check fee paid under 15010-20000-00106"""
671,13010-20001-04265,***REVISE STRUCTURAL & ARCHITECTURAL PLANS*** Accessory Living Quarter with attached garage.
672,13016-20000-10730,CONVERT (E) DETACHED GARAGE INTO A NEW REC RM WITH HALF BATH; REMOVE (E) GARAGE DOOR AND INFILL THE OPENINGS.
673,15014-20000-00463,PROPOSE (N) SECOND STORY ADDITION OVER (E) ONE STORY SFD & CONVERT 255SF (E)BEDROOM TO (N) GARAGE
674,17016-10002-19631,"Supplemental to 17016-10000-19631 to correct setbacks of ADU. existing side setback is 1'-0"""
675,16019-10000-02715,DEMO OF ACCESSORY STORAGE BUILDING: 384 SQ FT 16 'X 24'. DEMO BY HANDWRECK. SEWER CAP IS NOT REQUIRED. COMPLY WITH DEPARTMENT ORDER effective date 10/29/2010.  PERMIT WILL EXPIRE IN 30 DAYS FROM ISSUANCE DATE.
676,11030-10000-03714,GRADING FOR SWIMMING POOL AND WOOD DECK EXPANSION ACCESSORY TO SINGLE FAMILY DWELLING (55 C.Y.)
677,17043-10001-03918,"PLAN CHECK AND PERMIT DUE TO LOST PLANS. 24 HEADS PAID UNDER MASTER PERMIT (17043-10000-03918). ADDITIONAL NINE (9) HEADS. NEW FIRE PROTECTION SYSTEM FOR SINGLE FAMILY DWELLING. 1"" WATER METER, 1-1/4"" UNDERGROUND. NO BACKFLOW PREVENTION DEVICE REQUIRED."
678,13016-20000-05171,CONVERT EXISTING LIVING ROOM TO NEW BEDROOM TO EACH UNIT W/IN  EXISTING 1-STORY DUPLEX
679,13016-10000-13440,"INTERIOR REMODEL OF (E) S.F.D.  CONVERT KITCHEN TO MASTER BEDROOM, BATH AND CLOSET, CONVERT LIVING ROOM TO KITCHEN, REPLACE 9 WINDOW. NEW LAUNDRY CLOSET.  ALL WORK PER WOOD FRAME PRESCRIPTIVE PROVISIONS."
680,14016-10000-23854,CONVERT (E) LAUNDRY ROOM TO BATHROOM.
681,16014-20000-03818,"CONVERT 23' X 6'8"" IRR SHAPE PORTION OF (E) ATTACHED COVERED PATIO TO BEDROOM AND BATHROOM EXPASION PER ENGINEERING."
682,13019-20000-01617,DEMO PERMIT FOR SFD & ACCESSORY BLDG
683,17030-30000-04770,Removal and Recompaction for New SFD and Detached Garage/ADU
684,14014-20000-01609,"CONVERT (E) BEDROOM TO HALLWAY & ADD (2) BEDROOMS & BATHROOM (21'-8"" X 23') TO (E) 1-STORY SFD **** COMPLY WITH DEPARTMENT ORDER EFFECTIVE DATE 12/24/2012. PERMIT WILL EXPIRE 30 DAYS FROM ISSUANCE DATE ****"
685,17016-10000-02779,INTERIOR REMODEL CONVERTING (2) BEDROOM AND (1) BATHROOM INTO (3) BEDROOMS AND (2) BATHROOMS.
686,15014-70000-00280,"Add a second story storage room to an existing  one story accessory building. ""COMPLY WITH DEPARTMENT ORDER effective date 06/25/2014. PERMIT WILL EXPIRE 30 DAYS FROM ISSUANCE DATE""."
687,13016-20000-25674,NON STRUCTURAL REMODEL TO CONVERT DUPLEX TO SINGLE FAMILY DWELLING
688,14010-30000-00449,New accessory building (recreation room)
689,17016-20000-16182,"Interior remodel to extend  (e) bathroom, and  convert  (e) closet to a (n) bathroom and (n) closet."
690,13014-10000-04090,ADDITION OF 1ST AND 2ND FLOOR AND CONVERT (E) SINGLE FAMILY DWELLING TO DUPLEX WITH ATTACHED (2) CAR GARAGE.
691,19016-70000-00099,CONVERT GARAGE TO ORIGINAL CONDITION.  (REMOVE BATHROOM AT GARAGE AND REMOVE DOOR INFILL TO RETURN GARAGE OPENING TO ITS ORIGINAL CONDITION)
692,15016-30000-04166,"Interior and exterior alterations to convert existing den to bedroom and add new closet, remove existing exterior door and replace with new window. All work per ""WFPP"", walls being created or altered are non-bearing.(see comments)"
693,13010-30000-01386,"New 1-story accessory living quarters (16 ft x 40 ft, 640 sf)."
694,15020-20000-01495,"NEW RETAINING WALL TO RAISE GRADE -  RETAINING HT VARY AND UP 2'-6"" MAX. RETAINING;  WALL HT. UP TO 3' HT INCLUDING 6"" FREEBOARD,  LENGTH = 40 LF."
695,14014-20000-00474,"ADDITION TO ENLARGE TWO BEDROOMS, CONVERT ONE CLOSET TO A BATHROOM/CLOSET, ENLARGE FAMILY ROOM AND REMODEL THE KITCHEN/EXISTING BATHROOM.  ALL WORK PER ENG CALCS."
696,17016-10000-16351,"INTERIOR REMODEL OF (E) 1-STORY S.F.D TO CONVERT DINNING ROOM TO KITCHEN, (E) KITCHEN TO MASTER BEDROOM & EXISTING BATH TO (2) BATHROOMS. FRONT UNIT."
697,16010-20000-04477,PROPOSED NEW TWO STORY ACC DWELLING UNIT (ADU) PER AB 2299 & SB 1069 W/ ATT 2-CAR GARAGE (FOR MAIN DWELLING UNIT) & ONE OPEN STALL @ FRONT FOR ADU. SEE COMMENTS.
698,17016-70000-04448,CONVERT (E) RECREATION ROOM TO ACCESSORY DWELLING UNIT PER AB 2299 AND SB 1069
699,17016-70000-05096,CONVERT EXISTING DEN INTO BEDROOM FOR EXISTING 1-STORY SINGLE FAMILY DWELLING. NO ADDITIONAL SQUARE FOOTAGE ADDED AND NO STRUCTURAL WORK.
700,14016-10000-04327,"CONVERT SINGLE HOUSE (34'-0"" x 62'-0"") TO DUPLEX (1300 SQ. FT. AND 808 SQ. FT)"
701,17010-20001-02051,SUPPLEMENTAL TO 17010-20000-02051 TO REVISE LOCATION OF ACCESSORY LIVING QUARTERS
702,17016-20000-05280,"Remodel (E) Kitchen, Convert 5' x 5' Portion of (E) Kitchen to 1/2 Bath & Relocate Laundry."
703,17043-20000-00949,"NEW 13D SYSTEM FOR AN ACCESSORY LIVING QUARTERS. EXISTING 1-1/2"" DOMESTIC METER SHARED WITH MAIN HOUSE, NO BACKFLOW"
704,17016-70000-37501,"INTERIOR REMODEL TO EXISTING SINGLE FAMILY DWELLING TO CONVERT (E) SERVICE PORCH TO 3RD BEDROOM, CREATE ADDITIONAL BATHROOM (2 TOTAL ), NEW LAUNDRY ROOM, AND KITCHEN RELOCATION."
705,14014-20001-02678,"SUPPLEMENTAL PERMIT FOR 14014-20000-02678 TO EXTEND ACCESSORY LIVING QUARTERS BY ENCLOSING COVERED DECK ABOVE (18'-2"" X 4'), REMOVE STAIRS & PORTION OF DECK AT REAR, DEMO PORTION (1' X 18'-2"") OF (E) GARAGE BELOW & ADD SPIRAL STAIRS PER LA CITY STD PLAN #111"
706,14016-20000-06391,Convert existing den into bedroom in existing SFD.   Replace interior door.   No construction.
707,14016-20000-11609,Enlarge (e) bathrom and convert (e) walk-in closet into shower space.  All work per WFPP.
708,16016-30000-08424,Interior remodel of 2nd floor master bathroom and closet. Convert portion of closet to new bathroom.
709,15014-20000-04113,"Convert (e) 20'-7"" x 20'-6"" garage to laundry area/storage/recreation room and add 18'-4"" x 24'-11"" carport; add 19'-8"" x 8'-2"" irr. patio cover;  close off 1 window in (e) den."
710,17019-20000-02748,"DEMO (E) SFD, ACCESSORY LIVING QUARTERS, AND TENNIS COURT TO CLEAR THE LOT - SEWER CAP REQUIRED"
711,17046-10000-01842,1 HYDRO ELEVATOR FOR ACCESSORY LIVING QUARTER.
712,16043-20000-04194,"NEW 13D SYSTEM FOR AN ACCESSORY LIVING QUARTERS. 1 INCH METER, NO BACKFLOW"
713,15016-10000-15713,"Interior remodel to convert hallway closet and corridoor to a full bathroom, and install a skylight; All work per WFPP"
714,14016-10000-25583,"INTERIOR REMODEL OF EXISTING 1 STORY SFD TO CONVERT FAMILY ROOM TO BEDROOM AND ADD BATHROOM AND CLOSET WITHIN EXISTING BEDROOM TO CREATE MASTER SUITE. REMODEL EXISTING BATHROOM, REPLACE WINDOWS. NEW NON-BEARING WALLS. ALL WORK PER WFPP"
715,16016-20000-12110,INTERIOR NON-STRUCTURAL REMODEL TO CONVERT (E) STUDY AND SITTING ROOM TO A BEDROOM AND BATHROOM
716,15016-70000-05205,CONVERT EXISTING FAMILY ROOM TO BEDROOM. ALSO INTERIOR REMODEL TO CREATE NEW BATHROOM.  ALSO RE-ROOF
717,14016-20000-05055,"CONVERT (E) DEN TO (N) BEDROOM W/ CLOSET AT FIRST FLOOR, CONVERT (E) CLOSET TO (N) BATHROOM AND ADD NEW CLOSET AT (E) BEDROOM ON THE SECOND FLOOR"
718,14014-20000-03116,"CONVERT (E) GARAGE TO ACCESSORY LIVING QUARTERS (36'-2"" X 18'-6"") & ADD STORAGE BASEMENT (36'-2"" X 12'-7"") (NFPA-13D FIRE SPRINKLERS THROUGHOUT)"
719,14014-20000-04661,"Addition to existing accessory living quarters, irregular 22'-0"" x 26'-10"" ground floor and an irregular 25'0"" x 26'11"" basement."
720,16014-20000-01230,"ADD 188 SF TO GAR. & ALSO CONVERT 275 SF KITCHEN TO CREATE 2-CAR. GAR., ADD  519 SF 2ND FLR.  NEW REC RM WITH 1/2 BATH  & INT.  REMODEL. TO (E) SFD W/ATT. GARAGE."
721,15014-20000-03874,CONVERT EXISTING GARAGE TO MASTER BEDRM W/ BATH & CLOSET & LAUNDRY AREA.  ADD NEW 2-CAR CARPORT PER CITY STD DETAIL. ALL WORK PER 2011 WFPP.
722,14014-20000-01932,"KITCHEN REMODEL, CONVERT 1/2 OF (E) GARAGE TO OFFCE AND LAUNDRY 210 SQ. FT. ADD NEW 1/2 GARAGE 230 SQ. FT.  AND ADD NEW STORAGE 216 SQ. FT."
723,17016-20000-19366,"CONVERT THE (E) TWO CAR GARAGE  INTO LIVING SPACE, BEDROOM AND DEN."
724,14016-70000-01386,"Convert existing kitchen into a bedroom, relocate kitchen at dining area, and two new bathrooms at front unit. Convert existing kitchen and bathroom into a bedroom, relocate kitchen to exisitng living room, and new bathroom at existing rear unit."
725,16016-10000-04537,"Convert portion of existing kitchen into bathroom. Convert existing exterior door to window for new bathroom in bedroom. ""COMPLY WITH DEPARTMENT ORDER effective date 09/03/2009. PERMIT WILL EXPIRE 30 DAYS FROM ISSUANCE DATE."""
726,14014-20000-00396,"17'-11"" x 17' bathroom/closet addition above (E)garage.  Convert (E)closet to extend (E)adjoining bedroom."
727,14014-20000-03665,"CONVERT (E) BEDROOM TO (N) BATHROOM, REMODEL KITCHEN, RECONFIGURE CLOSET AND BATHROOM, REMOVE  FAMILY ROOM/LIVING ROOM SEPARATTION WALL, ADD 15'3"" X 8'4"" ATTACHED OPEN TRELLIS AND  ADD 15' X 38'4"" IRREGULAR SHAPE AREA AT  REAR  FOR NEW BEDROOM AND KITCHEN/FAMILY ROOM EXPANSION AND CONNECT WITH DETACHED GARAGE.  ALL WORKS PER DESIGN."
728,16016-10000-02106,CONVERT STORAGE ROOM TO BEDROOM AND ADD 1/2 BATH AND CLOSET FOR BEDROOM
729,14014-20000-04208,"REMODEL INTSERIOR TO  CONVERT 1 BEDROOM TO DEN AND LAUNDRY CLOSET, ADD  2 AREASS OF 2'7"" X 7' ON BOTH SIDES OF FIRE PLACE TO FLUSH OUT BUILDING EVENLY AND RE-FRAME PORTION OF ROOF OVER LIVING ROOM AND BEDROOM.  ALL WORKS PER ENGINEERING."
730,13014-10000-04993,New two story accessory living quarters consisting of a 2-car garage and storage room on the first floor.
731,16016-70000-07685,INTERIOR REMODEL TO EXISTING SINGLE FAMILY DWELLING TO CONVERT EXISTING WALK-IN CLOSET TO NEW BEDROOM. REMODEL TWO BATHROOMS AND CREATE NEW CLOSET.
732,13010-30000-02376,NEW ACCESSORY LIVING QUARTER.
733,14010-30000-02851,New accessory living quarters with bathroom and basement.
734,16014-20000-02534,"IRREGULAR SHAPED ADDITION OF 23'0"" X 43'2"" AND CONVERT EXISTING 15'0"" X 20'0"" COVERED PATIO AT THE REAR OF THE SFD W/ ATTACHED GARAGE TO ADD 3 NEW BEDROOMS, 2 BATHROOMS, AND RECREATION ROOM.  ALL WORK PER WFPP."
735,16016-20000-14660,"REMODEL  BATHROOM, CONVERT (1) BEDROOM TO DEN, REMOVE NON BEARING WALLS ) TO COMBINE STORAGE ROOM AND ATTACHED GARAGE.  ALL WORKS ARE PER WFPP."
736,16043-10001-01558,"REVISION TO PREVIOUSLY APPROVED PLANS. CHANGING PIPING LAYOUT AND UPDATE HYDRAULIC CALCULATIONS. TOTAL NUMBER OF HEADS = 27 (PREVIOUSLY 24)   ORIGINAL DESCRIPTION: NEW NFPA 13D FIRE SPRINKLER FOR THREE STORY SINGLE FAMILY DWELLING WITH ATTACHED CAR GARAGE AND ROOF DECK (LOT 6).  1"" WATER METER, NO RP BACKFLOW DEVICE."
737,16019-30000-02127,Demo sfd/attached garage/accessory building.Clear lot.
738,17014-10001-06610,SUPPLEMENTAL PERMIT FOR FLOOR PLAN CHANGES.  <PERMIT FEES PAID UNDER 17014-10000-06610><NO CHANGE IN VALUATION>
739,15014-10001-05265,**SUPPLEMENTAL** PERMIT TO #15014-10000-05265 TO CONVERT APPROVED CARPORT TO 2-CAR GARAGE
740,13014-10000-00460,CONVERT (E) BATHROOM INTO 2 SEPARATE BATHROOMS AND ADD 8' X 10' ATTACHED RECREATION ROOM TO THE REAR OF (E) SFD PER ENGINEERING.
741,13016-30000-12144,NON-STRUCTURAL INTERIOR REMODEL TO (E) BATHROOM IN (E) ACCESSORY LIVING QUARTERS
742,12014-20003-04664,Supplemental permit to convert carport to Garage
743,14016-20000-19836,CONVERT MODEL DWELLING UNDER 09010-20000-01561 TO SINGLE FAMILY DWELLING (NO PHYSICAL WORK)
744,12016-40000-24535,CONVERT ATTIC TO A  2nd STORY AND INTERNAL REMODEL OF AN (E) SFD
745,18043-20000-00962,"NEW 13D SYSTEM FOR ACCESSORY DWELLING UNIT. 1 INCH METER, NO BACKFLOW"
746,13016-20000-18030,Remodel (e) kitchen and one bathroom.Convert potion of (E) full bathroom into a powder room to creat two bathroom.Change out two windows.
747,15016-70000-17402,INTERIOR REMODEL: CONVERT EXISTING FAMILY ROOM INTO NEW BED ROOM (11.5FT X 14.33FT) AND EXISTING CLOSET TO NEW BATH ROOM (5FT X 6.5FT) TO EXISTING ONE STORY SFD.
748,15016-20000-06134,"Convert (e) detached garage to recreation room with 1/2 bathroom.  Construct ceiling. Add 18'6"" x 21'-9"" carport."
749,14016-10000-02180,CONVERT CLOSET TO BATHROOM BY ADDING PLUMBING & ELECTRICAL + HVAC.
750,18014-30000-02468,"Convert into living space, enclose entry covered patio and add garage."
751,16016-30000-24533,"Convert (e) SFD to Duplex. New partition wall separating units, no additional square footage. Total of 4 parking spaces provided on site, 2 standard covered on (e) garage."
752,15014-20000-04445,"IRR SHAPE ADDITION 7'9"" X 8'-8"" TO THE FRONT OF THE HOUSE. CONVERT (E) BEDROOM TO OFFICE AND MOVE BATHROOM. ALL WORK PER ENG."
753,18016-10000-23066,Convert existing front SFD to duplex per ADM-2018-3918-UDU. (One low income unit per 14.00.A.10)
754,13016-10000-22175,INTERIOR REMODEL OF EXISTING S.F.D.(WFPP) BY CONVERTING DEN INTO BEDROOM AND LAUNDRY PORTION INTO BATHROOM PER TYPE V CONSTRUCTION (PRESCRIPTIVE PROVISIONS) RESULTING IN 3 BEDROOMS 2 BATHROOMS.
755,16016-20000-09190,CONVERT 3/4 BATHROOM TO FULL BATHROOM AND REMODEL; RELOCATE CLOSET DOOR
756,13014-20000-05349,TO CONVERT A N ATTACHED GARAGE TO HABITABLE SPACE. TO ADD A NEW ATTACHED GARAGE. TO CHANGE ROOF FRAMING IN FRONT HALF TO  CALIFORNIA  FRAMING. TO ADD & REMODEL.
757,15016-70000-10278,INTERIOR REMODEL ON BOTTOM UNIT OF EXISTING DUPLEX. CONVERT EXISTING CLOSET AND PORTION OF HALLWAY INTO BATHROOM.
758,13016-20000-11774,interior remodel: convert (e) bed room into 2 bath rooms.Convert one  closet to a powder room and one closet to a laundry room.
759,15016-20000-26907,"REMODEL (E) KITCHEN AND BATHROOM, CONVERT FAMILY ROOM TO A NEW BEDROOM AND AND DINING ROOM. CONVERT EXISTING STORAGE TO A NEW BATHROOM WITH WALK IN CLOSET"
760,14016-20000-02471,"CONVERT 20'2"" X 18'2"" GARAGE TO REC. ROOM attached to (E) BATH HOUSE(See comments)."
761,16016-20000-10248,"CONVERT  7'-6"" X 6'-0"" POR. OF (E) CLOSET & BEDROM  INTO A (N) 3/4 BATHRM, REMOVE (E) NON-BEARING WALL IN KITCHEN & REMODEL (E) FULL BATHRM . REPLACE (E) BEDROOM WINDOW WITH A SLIDING DOOR. ALL WORKS PER WFPP."
762,16016-10000-18219,"INTERIOR REMODEL TO CONVERT CLOSET INTO 1/2 BATHROOM.  REMODEL KITCHEN AND TWO BATHROOMS.  Change  kitchen  cabinets,   new  appliances  and  change out  light  fixtures  throuout the  sfd .  Change out outlets  and  switches throuhout the  sfd.   Infill two  exterior  doors  at  the  rear  of the  dwelling as  shown   on  the proposed floor plan. COMPLY WITH DEPARTMENT ORDER effective date 07/27/2016. PERMIT WILL EXPIRE 30 DAYS FROM ISSUANCE DATE""."
763,18016-10000-35082,"PROPOSED REMODEL TO SINGLE FAMILY DWELLING TO CONVERT TWO BEDRROOMS AND A BATHROOM INTO ONE MASTER SUITE; WORK TO INCLUDE FOUNDATION REPAIR, REPLACE DAMAGED WALLS AND INTERIOR WORK PER ENGR'S DESIGN."
764,14016-10000-15074,"INTERIOR REMODEL OF EXISTING SINGLE FAMILY DWELLING: TO CONVERT EXISTING FAMILY ROOM 13'-6""x28'-0"" TO TWO BEDROOMS, REMODEL BATHROOM AND KITHCEN. NO NEW FLOOR AREA."
765,17016-30000-26511,"Convert 12'5"" x 18'6"" portion of detached  garage to to Rec. Room with half bathroom. (See comments)."
766,15016-20000-06876,CONVERT DUPLEX TO SFD & INTERIOR REMODEL (NEW A/C)
767,14014-20000-00732,"Add (20' x 30') garage to (e) sfd; convert (e) (22'5"" x 24'2"") garage to (2) bedrooms w/ bathroom; remodel to install new door, remodel closet, and water heater enclosure at entry. Interior remodel to enlarge (1) bedroom, and convert (e) bedroom to a laundry room. All work per WFPP P/BC 2011-004"
768,16016-20000-06034,CONVERT (E )2ND FLR BEDROOM TO SITTING ROOM & FULL BATH  AND CONVERT (E) 1ST FLR CLOSET& 1/2 BATH TO 3/4 BATH. REPLACE (2) WINDOWS.
769,15014-20001-02297,Supplemental to permit # 15014-20000-02297 to convert storage to bedroom and  add new bathroom
770,15016-20000-23426,"CONVERT (E) 10'-0"" X 20'-0"" ATTACHED GARAGE TO (N) BEDROOM AND CONVERT (E) 8'-0"" X 12'-0"" ATTACHED STORAGE TO (N) BATHROOM AND LAUNDRY. ALL WORK PER WFPP."
771,13014-20000-05204,"7' x 18'4"" ADDITION TO EXTEND FULL BATHROOM, CONVERT 5' X 8' GARAGE AREA TO 1/2 BATH AND REMODEL TO CREATE LAUNDRY ROOM TO (E) 1 STORY SFD W/ GARAGE"
772,13016-20000-18512,remove unapproved interior works and convert back to existing 2 car garage
773,17016-20000-03626,"NON-STRUCTURAL REMODEL. CONVERT THE (E) FAMILY ROOM INTO A NEW BEDROOM, CONVERT THE (E) BATHROOM INTO A WALK-IN CLOSET, CONVERT THE WALK IN CLOSET TO A NEW 3/4 BATHROOM."
774,17016-10000-02865,INTERIOR REMODEL  CONVERT 4 BED 2 BATH TO 5 BED  3 BATH
775,17016-20000-00330,NON STRUCTURAL INTERIOR REMODEL TO CONVERT PORTION OF (E) LIVING ROOM TO A BEDROOM.
776,18020-20000-02961,Shoring for basement of new Accessory Living Quarter
777,14014-20000-01587,"CONVERT PORTION OF (E) ATTACHED (20'X21') CARPORT TO CREATE (10'X21')  NEW LAUNDRY RM & 3/4 BATH ""ACCESS FROM THE (E) HOUSE"", & ADD (12'X21') TO THE CARPORT & CONVERT TO NEW (22'X21') ATTACHED GARAGE."
778,16014-20000-01203,"Add Irr. 13'-8"" x 22'-11"" (N) bedroom with full bath and convert  (E) 3/4 bath to hallway per WFPP,  Remodel existing kitchen"
779,14014-70000-00425,"Convert the existing attached garage into living area (two bedrooms) for the attached single family dwelling at rear. Also, attach a one-car carport."
780,13016-10000-04650,"5' x 14'-10"" addition for closet/hallway.  Convert (E)duplex to SFD; convert (E)kitchen/family room to (N)bathroom/bedroom.  Convert (E)breakfast nook/bathroom to (N)kitchen.  Convert (E)kitchen to dining room extension.  Convert (E)bedroom to extend (E)living room.  Remodel (E)bathroom.  Convert (E)bedroom to patio cover.  Install/replace doors/windows per plan.  Remove (E) 10' x 18' att carport. All work per WFPP sheet."
781,13014-20000-02298,"3' X 41'1"" ADDITIONTO EXPAND LIVING/DINING ROOM, CONVERT 10'9"" X 28'8"" PORTION OF GARAGE TO EXERCISE/ LAUNDRY ROOM AND REMODEL TO (E) 1 STORY SFD. REPLACE EXISTING DECK WITH 26' X 41' DECK"
782,16014-10000-05334,"Convert (e) den into bedroom; Add 1-story irregular 26'4"" x 25'2"" 2nd unit to (e) 1-story SFD converting it to a 1-story Duplex; All work per WFPP."
783,15016-20000-02188,INTERIOR REMODEL TO CONVERT (E) STORAGE ROOM TO 1/2 BATHROOM AT LOWER LEVEL OF (E) TWO STORY DWELLING
784,16019-70000-04395,Demolition of detached garage. New accessory living quarter with attached 4-car garage under 15010-10000-00837.  Sewer Cap and Pedestrian protection fence required.
785,18016-70000-11494,CONVERT (2) DINING ROOMS IN (E) DUPLEX TO BEDROOM. REMOVE UNPERMITTED BATHROOM FROM GARAGE PER HOUSING REQUEST. ALL CONSTRUCTION PER TYPE V
786,12020-10001-00767,"SUPPLEMENTAL TO PERMIT No.: 12020-10000-00767 TO CORRECT AND UPDATE LENGTH OF WALL TO MATCH WITH PLAN AND PER INSPECTOR CORRECTION. TOTAL LENGTH OF RETAINING WALL TO BE 105'-0"" IN LENGTH. NO FEE DEPARTMENT ERROR."
787,14010-20001-00080,"NEW ACCESSORY LIVING QUARTERS (PREFAB FACTORY BUILT HOUSING UNIT), FULLY SPRINKLER, SUPPLEMENT TO PERMIT 14010-20000-00080 REVISE PLOT PLAN FOR FENCE ENCLOSURE AREA."
788,17016-20000-36293,"NON STRUCTURAL INTERIOR REMODEL TO CONVERT CLOSET INTO 3/4 BATHROOM AND LAUNDRY ROOM, AND ADD CLOSETS IN TWO (E) BEDROOMS."
789,16043-20000-04994,"NEW 13D SYSTEM FOR ACCESSORY LIVING QUARTERS. 1 INCH DOMESTIC METER, NO BACKFLOW"
790,15016-20000-03323,iNT. RREMODEL TO CONVERT (E) LAUNDRY ROOM TO 1/2 BATH/ LAUNDRY TO (E) SFD
791,15010-20000-04375,"(N) 51'-5"" X 22'-7"" ONE-STORY ACCESSORY LIVING QUARTERS W/ 51'-5"" x 5'-0"" ATT.  PATIO COVER, TYPE VB CONSTRUCTION."
792,13016-20000-08040,"Remodel (E)1st floor; convert (E)portion of dining area into closet for unit above, convert two (E)bathrooms into bathroom/closet, convert (E)office/closet into closet/bathroom, convert (E)closet into laundry closet, remodel (E)kitchen & replace windows per plan."
793,17016-10000-04468,CONVERT AN EXISTING DUPLEX TO A SINGLE FAMILY DWELLING
794,16010-10000-00987,"NEW ACCESSORY LIVING QUARTERS (822 SQ FT) W/ ATTACHED TRELLIS LOCATED IN REAR OF LOT, 2 OF 4 SEE COMMENTS"
795,16030-10000-07983,Grading for retaining wall and under floor addition .
796,12014-30000-03726,ADDITION OF TWO STORY ACCESSORY LIVING QUARTERS TO  THE REAR OF EXISTING GARAGE.
797,13014-20002-02236,"SUPPLEMENTAL PERMIT OF 13014-10000-02236 TO CONVERT GYM ROOM INTO NEW BEDROOM, RESHAPE BEDROOM CLOSETS, RELOCATE BATHTUB / SKYLIGHTS, REVISE CEILING FRAMING ACCORDINGLY, RAISE DROP BEAM AT LIVING ROOM AND RELOCATE 1 CONCRETE PILE FOOTING AT GARAGE."
798,16014-20000-05764,"ADD 21' X 17'  ATT. OPEN TRELLIS & CONVERT (E) 21'-6"" x 21' IRR RECRM W/ HALF BATH TO STUDY WITH 3/4 BATH (ADD NEW OPENING BETWEEN KITCHEN AND PROPOSED STUDY)."
799,17016-30000-11932,Convert closet to full bathroom.
800,15016-40000-09359,CONVERT (E) CLOSET TO BATHROOM. BUILD NEW CLOSET FOR (E) BEDROOM.
801,15014-20000-05867,"Convert 12'-5"" x 22'-6"" portion of the (e) carport to new bedroom with bathroom and closet and convert / add new 23'-0"" x 23'-0"" attached 2- car garage.  All work per engineering plans."
802,14020-40000-02502,NEW PARKING AREA  ACCESSORY TO (E) RESIDENTIAL (SFD AND DUPLEX) USE OF LOT.
803,13010-20000-03037,"(N) 16'4""X 32' 1 STORY ACCESSORY LIVING QUARTERS"
804,17016-20000-11023,"INTERIOR REMODEL TO CONVERT 2'-2"" x 4'-1"" PORTION OF STORAGE OF (E) SFD TO 3/4 BATHROOM AND ADD NEW PARAPET WALL TO MATCH (E) PARAPET"
805,15014-20000-00217,"INTERIOR RENOVATION OF MAIN FLOOR, CONVERT UNDER FLOOR AREA INTO DEN AND 3/4 BATH W/ STORAGE CREATING 2 STORY SFD W/ GARAGE"
806,13016-20000-06813,CONVERT EXISTING 2 CLOSETS INTO A 3/4 BATHROOM AND ADD 2 NEW WINDOWS.
807,16014-20001-00985,"SUPPL. PERMIT OF 16014-20000-00985 TO CONVERT ENCLOSED PORCH AREA TO LIVING ROOM EXPANSION, DINING ROOM TO (N) BEDROOM, BEDROOM TO STUDY ROOM AND EXTEND PATIO COVER TO 4' X 10' PER WFPP."
808,18016-10001-23017,SUPPLEMENTAL TO PERMIT #18016-10000-23017 TO REVISE FLOOR PLAN OF ADU TO CREATE A ONE BEDROOM ADU. NO CHANGE IN FLOOR AREA.
809,14014-20000-00820,"Remodel entire (E)SFD, including converting (E)18' x 18' garage into habitable space.  Add 31'-6"" x 23' three car garage to front.  33'-6"" x 36'6"" two story addition with roof deck & deck/balcony, connected to (E)SFD by 7' x 27'-6"" hallway.  Bldg. shall be fully sprinklered."
810,13014-10000-05254,Convert (E) SFD to duplex with second floor addition.
811,13010-30000-01091,NEW 2 CAR GARAGE WITH ACCESSORY LIVING QUARTERS ABOVE.
812,15016-30000-05979,"Convert (E) 20' X 13' bedroom into 2 bedrooms| Remodel (E) kitchen, bath. | Provide (N) window at (N) bedroom and (E) bathroom| Replace (E) windows with same size same type same location| No changes to (E) floor area."
813,16016-70000-10932,"Interior remodel to existing duplex to convert existing laundry room into a bedroom in each unit, relocate kitchen, relocate bathroom, and change out windows and doors. No increase in habitable rooms."
814,15016-20000-11465,"CONVERT (E) CLOSET TO A NEW 3/4 BATHROOM, REFRAME FOR VAULTED CEILING IN THE LIVING ROOM.  SEE COMMENT."
815,16010-20001-01173,SUPPLEMENTAL TO CHANGE ADDRESS AND UPDATE LEGAL FROM 22720 W. VANOWEN STREET  TO 6746 N. GLASNER LANE PER TRACT MAP # 72880
816,17016-20000-12936,"INTERIOR REMODEL TO (E) SFD, CONVERT (E) DEN TO NEW BEDROOM, AND REMOVE TWO WINDOWS AND ADD ONE WINDOW IN KITCHEN AREA. REPLACE ALL REMAINING EXISTING WINDOWS WITH SAME SIZE."
817,17014-20000-02142,"CONVERT THE (E) 17'-6"" X 20'-4"" ATTACHED GARAGE INTO RECREATION ROOM AND ADD 18'-0"" X 19'-6"" ATTACHED CARPORT. ALL WORK PER WFPP."
818,14016-20000-11102,"INTERIOR NON STRUCTURAL REMODEL - CONVERT (E) WALK IN CLOSET INTO (N) BEDROOM, REMODEL (E) BEDROOM. ALL WORK PER WFPP."
819,18016-10000-01208,CONVERT HALLWAY TO BATHROOM AT SECOND FLOOR OF ( E ) TWO STORY SINGLE FAMILY DWELLING .
820,13014-20000-04877,"add 8'x9'-3"" to enlarge existing bathroom and closet, convert 10' x 6' garage area to laundry room, remove interior wall between kitchen and dining room and remodel kitchen, add and replace sliding doors in living room and kitchen."
821,14014-70000-03415,REAR ADDITION TO CONVERT EXISTING SINGLE FAMILY DWELLING TO DUPLEX AND INTERIOR REMODEL.
822,18014-20000-02270,"INTERIOR REMODEL OF (E) SFD TO CREATE NEW BATHROOM , CONVERT (E) LAUNDRY TO MASTER BATHROOM, CONVERT PORTION OF (E) BATHROOM TO NEW POWDER ROOM , REMODEL (E) KITCHEN, MASTER BEDROOM , MASTER CLOSET, BEDROOM # 2, FAMILLY ROOM . ALL WORK PER ENGINEERING"
823,18016-20000-03452,Interior remodel to convert existing half bathroom into 3/4 bathroom
824,17016-70000-28847,interior alteration to convert living room to (N) bedroom on both units of (e) one story duplex and kitchen remodel
825,15016-70000-18402,Interior alteration to existing single family dwelling to convert office area into a bedroom.
826,18016-20000-07343,NON-STRUCTURAL INTERIOR REMODEL TO CONVERT ONE BATHROOM INTO TWO BATHROOMS AT SECOND STORY OF (E) TWO STORY SFD.
827,15014-10002-01409,"SUPPLEMENTAL TO PERMIT #15014-10000-01409 TO CONVERT (E) 1/2 BATHROOM TO A 3/4 BATHROOM, RELOCATE LAUNDRY AND CREATE A (N) DOOR AT THE EXTERIOR STAIRCASE. REVISE BEDROOM FLOOR LAYOUT ON SECOND FLOOR."
828,19016-20000-05767,Convert (e) full bthrm into 3/4 bthrm and convert portion of (e) bedroom into new full bthrm with new window. Convert linen closet into laundry room.
829,15016-70000-12254,"Interior alteration to existing single family dwelling to convert closet into masterbedroom, convert closet into a laundry room, convert powder room into closet, remodel the kitchen, bathroom remodel, and re-roof."
830,16016-20000-02850,Interior remodel to convert a portion of the recreation room on the 2nd floor into a bedroom. Construct non-structural walls.
831,15014-20000-01142,"CONVERT (E) ATTACHED GARAGE TO (N) RECREATION ROOM W/ EXTERIOR ACCESS ONLY (NO PLUMBING); ADD (N) LAUNDRY ROOM (6' X 6'-6""); ADD (N) ATTACHED 2-CAR CARPORT (18' X 18') AT FRONT (ALL WORK PER ENGINEERING)"
